[
  {
    "record_id": "23ad2fd8-e074-475c-b678-7f3c703c5550",
    "received_at": "2026-09-21T20:11:58.087Z",
    "source": "email",
    "raw_message": "Hi, I tried logging in this morning and keep getting a 403 error. My account is arcvault.io/user/jsmith. This started after your update last Tuesday.",
    "classification": {
      "category": "Bug Report",
      "secondary_categories": [],
      "priority": "High",
      "llm_priority": "High",
      "priority_adjusted_by": null,
      "confidence": 0.94,
      "rationale": "'tried logging in... keep getting a 403 error' for a single account"
    },
    "enrichment": {
      "core_issue": "The customer cannot log in and receives a 403 error.",
      "identifiers": {
        "account_ids": [
          "arcvault.io/user/jsmith"
        ],
        "invoice_numbers": [],
        "error_codes": [
          "403"
        ],
        "urls": [
          "arcvault.io/user/jsmith"
        ],
        "monetary_amounts": [],
        "products_or_features": [],
        "other": [
          "last Tuesday"
        ]
      },
      "dropped_identifiers": [],
      "urgency_signal": {
        "level": "High",
        "evidence": [
          "403 error",
          "logging in"
        ]
      }
    },
    "routing": {
      "standard_queue": "engineering",
      "destination_queue": "engineering",
      "routing_reason": "Bug Report -> engineering (category mapping, confidence 0.94)."
    },
    "escalation": {
      "flagged": false,
      "triggered_rules": [],
      "advisory_signals": [
        {
          "rule": "security_signal",
          "detail": "matched: 403; priority already High, no change; not escalated on its own"
        }
      ]
    },
    "summary": "The customer cannot log in and receives a 403 error on account arcvault.io/user/jsmith, which started after the update last Tuesday. This is a high‑priority issue affecting access to the service. Next step: engineering should investigate the authentication failure linked to the recent update.",
    "processing": {
      "model": "openai/gpt-oss-120b",
      "prompt_versions": {
        "classification": "classification.v2",
        "enrichment": "enrichment.v2",
        "summary": "summary.v1"
      },
      "latency_ms": 1889,
      "workflow_version": "1.0.1",
      "llm_errors": []
    }
  },
  {
    "record_id": "6733d2e9-74b4-44ab-8365-a54763be45fe",
    "received_at": "2026-09-21T20:12:47.123Z",
    "source": "web_form",
    "raw_message": "We'd love to see a bulk export feature for our audit logs. We're a compliance-heavy org and this would save us hours every month.",
    "classification": {
      "category": "Feature Request",
      "secondary_categories": [],
      "priority": "Low",
      "llm_priority": "Low",
      "priority_adjusted_by": null,
      "confidence": 0.94,
      "rationale": "'We'd love to see a bulk export feature for our audit logs'"
    },
    "enrichment": {
      "core_issue": "The customer requests a bulk export feature for audit logs.",
      "identifiers": {
        "account_ids": [],
        "invoice_numbers": [],
        "error_codes": [],
        "urls": [],
        "monetary_amounts": [],
        "products_or_features": [
          "bulk export",
          "audit logs"
        ],
        "other": []
      },
      "dropped_identifiers": [],
      "urgency_signal": {
        "level": "Low",
        "evidence": [
          "bulk export feature",
          "save us hours every month"
        ]
      }
    },
    "routing": {
      "standard_queue": "product",
      "destination_queue": "product",
      "routing_reason": "Feature Request -> product (category mapping, confidence 0.94)."
    },
    "escalation": {
      "flagged": false,
      "triggered_rules": [],
      "advisory_signals": []
    },
    "summary": "The customer requests a bulk export feature for audit logs. They note that, as a compliance‑heavy organization, this would save them hours each month. Add this request to the product backlog for future prioritization.",
    "processing": {
      "model": "openai/gpt-oss-120b",
      "prompt_versions": {
        "classification": "classification.v2",
        "enrichment": "enrichment.v2",
        "summary": "summary.v1"
      },
      "latency_ms": 2284,
      "workflow_version": "1.0.1",
      "llm_errors": []
    }
  },
  {
    "record_id": "c2c33051-de2d-4f41-9700-140425146381",
    "received_at": "2026-09-21T20:13:36.646Z",
    "source": "support_portal",
    "raw_message": "Invoice #8821 shows a charge of $1,240 but our contract rate is $980/month. Can someone look into this?",
    "classification": {
      "category": "Billing Issue",
      "secondary_categories": [],
      "priority": "Medium",
      "llm_priority": "Medium",
      "priority_adjusted_by": null,
      "confidence": 0.95,
      "rationale": "Invoice #8821 shows a charge of $1,240 but our contract rate is $980/month"
    },
    "enrichment": {
      "core_issue": "The customer reports that Invoice #8821 shows a charge of $1,240 but the contract rate is $980/month and requests a review.",
      "identifiers": {
        "account_ids": [],
        "invoice_numbers": [
          "#8821"
        ],
        "error_codes": [],
        "urls": [],
        "monetary_amounts": [
          "$1,240",
          "$980/month"
        ],
        "products_or_features": [],
        "other": []
      },
      "dropped_identifiers": [],
      "urgency_signal": {
        "level": "Medium",
        "evidence": [
          "charge of $1,240",
          "contract rate is $980/month"
        ]
      }
    },
    "routing": {
      "standard_queue": "billing",
      "destination_queue": "human_review_escalation",
      "routing_reason": "Escalated for human review (billing_amount_over_threshold); standard owner would be billing."
    },
    "escalation": {
      "flagged": true,
      "triggered_rules": [
        {
          "rule": "billing_amount_over_threshold",
          "detail": "basis=any_amount; largest amount $1240, discrepancy $260, threshold $500"
        }
      ],
      "advisory_signals": []
    },
    "summary": "Invoice #8821 shows a charge of $1,240 but the contract rate is $980/month, a $260 discrepancy. This billing difference exceeds the $500 escalation threshold, so it requires immediate human review. Action: assign to a billing specialist to investigate and adjust the invoice as needed.",
    "processing": {
      "model": "openai/gpt-oss-120b",
      "prompt_versions": {
        "classification": "classification.v2",
        "enrichment": "enrichment.v2",
        "summary": "summary.v1"
      },
      "latency_ms": 2347,
      "workflow_version": "1.0.1",
      "llm_errors": []
    }
  },
  {
    "record_id": "560750eb-a182-42b5-8243-8e8de3be3631",
    "received_at": "2026-09-21T20:14:26.003Z",
    "source": "email",
    "raw_message": "I'm not sure if this is the right place to ask, but is there a way to set up SSO with Okta? We're evaluating switching our auth provider.",
    "classification": {
      "category": "Technical Question",
      "secondary_categories": [],
      "priority": "Low",
      "llm_priority": "Low",
      "priority_adjusted_by": null,
      "confidence": 0.92,
      "rationale": "asks 'is there a way to set up SSO with Okta'"
    },
    "enrichment": {
      "core_issue": "The customer asks whether SSO with Okta can be set up.",
      "identifiers": {
        "account_ids": [],
        "invoice_numbers": [],
        "error_codes": [],
        "urls": [],
        "monetary_amounts": [],
        "products_or_features": [
          "SSO",
          "Okta"
        ],
        "other": []
      },
      "dropped_identifiers": [],
      "urgency_signal": {
        "level": "Low",
        "evidence": [
          "is there a way to set up SSO with Okta",
          "evaluating switching our auth provider"
        ]
      }
    },
    "routing": {
      "standard_queue": "technical_support",
      "destination_queue": "technical_support",
      "routing_reason": "Technical Question -> technical_support (category mapping, confidence 0.92)."
    },
    "escalation": {
      "flagged": false,
      "triggered_rules": [],
      "advisory_signals": []
    },
    "summary": "The customer asks whether SSO with Okta can be set up for their organization. This is a low‑priority technical question about authentication options. Next step: provide the standard documentation and steps for configuring Okta SSO in ArcVault.",
    "processing": {
      "model": "openai/gpt-oss-120b",
      "prompt_versions": {
        "classification": "classification.v2",
        "enrichment": "enrichment.v2",
        "summary": "summary.v1"
      },
      "latency_ms": 1935,
      "workflow_version": "1.0.1",
      "llm_errors": []
    }
  },
  {
    "record_id": "11e817f0-9e39-40ad-8691-29c25fa9515c",
    "received_at": "2026-09-21T20:15:14.992Z",
    "source": "web_form",
    "raw_message": "Your dashboard stopped loading for us around 2pm EST. Checked our end — it's definitely on yours. Multiple users affected.",
    "classification": {
      "category": "Incident/Outage",
      "secondary_categories": [],
      "priority": "High",
      "llm_priority": "High",
      "priority_adjusted_by": null,
      "confidence": 0.96,
      "rationale": "Multiple users affected and dashboard stopped loading for us"
    },
    "enrichment": {
      "core_issue": "The customer reports that the dashboard stopped loading and multiple users are affected.",
      "identifiers": {
        "account_ids": [],
        "invoice_numbers": [],
        "error_codes": [],
        "urls": [],
        "monetary_amounts": [],
        "products_or_features": [
          "dashboard"
        ],
        "other": [
          "2pm EST"
        ]
      },
      "dropped_identifiers": [],
      "urgency_signal": {
        "level": "High",
        "evidence": [
          "stopped loading",
          "Multiple users affected"
        ]
      }
    },